{
  "schema_version": 2,
  "request_fingerprint": "sha256:4c04cb6a6352ef10b09403b8f5b7da03e71dbfd278606fc25edb5274c3399d59",
  "plan_fingerprint": "sha256:cbcaf0102a11fc20d056d9a3fdb1ab5e40822ed53852cbf181cb90c80a68a1d9",
  "model": "example-review-model",
  "response_model": null,
  "response": {
    "text": "{\"diagnosis\":\"Null dereference\",\"evidence\":[\"trace line 42\"],\"next_step\":\"Guard the optional value\"}"
  },
  "usage": {
    "prompt_tokens": null,
    "completion_tokens": null,
    "total_tokens": null
  }
}
