{
  "schema_version": 2,
  "request_fingerprint": "sha256:c414887e9b38e3017d360214d9af77f2fa3329b941d4c8a64ede69d2e7083b07",
  "plan_fingerprint": null,
  "model": "synthetic-review-fixture",
  "response_model": null,
  "response": {
    "text": "{\"schema_version\":1,\"summary\":\"The selected source shows one important behavior whose test evidence was not included.\",\"findings\":[{\"category\":\"testing\",\"severity\":\"note\",\"title\":\"Whitespace-only rejection needs visible regression coverage\",\"message\":\"The validation branch rejects an empty cleaned name, but the selected context contains no test demonstrating that spaces and tabs raise ValueError.\",\"path\":\"examples/sample.py\",\"start_line\":10,\"end_line\":12}]}"
  },
  "usage": {
    "prompt_tokens": null,
    "completion_tokens": null,
    "total_tokens": null
  }
}
